question_order,question_type,text_uz,text_uz_cyrl,text_ru,points,is_active,work_domain,category,choice_1_text_uz,choice_1_text_uz_cyrl,choice_1_text_ru,choice_1_is_correct,choice_2_text_uz,choice_2_text_uz_cyrl,choice_2_text_ru,choice_2_is_correct,choice_3_text_uz,choice_3_text_uz_cyrl,choice_3_text_ru,choice_3_is_correct,choice_4_text_uz,choice_4_text_uz_cyrl,choice_4_text_ru,choice_4_is_correct
1,single,Какие основные правила техники безопасности при работе с газовым оборудованием?,Газовое оборудование билан ишлашда техника хавфсизлигининг асосий қоидалари қандай?,Какие основные правила техники безопасности при работе с газовым оборудованием?,2,TRUE,natural_gas,safety_logic_psychology,Всегда проверять герметичность соединений,Ҳамеша уланишларнинг герметиклигини текшириш,Всегда проверять герметичность соединений,TRUE,Использовать открытый огонь для проверки утечек,Утечкаларни текшириш учун очиқ оловдан фойдаланиш,Использовать открытый огонь для проверки утечек,FALSE,Работать без защитных средств,Ҳимоя воситаларисиз ишлаш,Работать без защитных средств,FALSE,Игнорировать инструкции по безопасности,Хавфсизлик бўйича кўрсатмаларни эътиборсиз қолдириш,Игнорировать инструкции по безопасности,FALSE
2,multiple,Какие действия необходимо предпринять при обнаружении утечки газа?,Газ утечкаси аниқланганда қандай харакатлар қилиш керак?,Какие действия необходимо предпринять при обнаружении утечки газа?,3,TRUE,natural_gas,safety_logic_psychology,Немедленно перекрыть газ,Дарҳол газни ёпиш,Немедленно перекрыть газ,TRUE,Проветрить помещение,Бинолни хаволаштириш,Проветрить помещение,TRUE,Вызвать аварийную службу,Аварий хизматни чақириш,Вызвать аварийную службу,TRUE,Зажечь спичку для проверки,Текшириш учун гўшт ўчқочини ёқиш,Зажечь спичку для проверки,FALSE
3,single,Какой процент кислорода в воздухе считается нормальным?,Ҳаводаги кислороднинг қандай фоизи нормал деб ҳисобланади?,Какой процент кислорода в воздухе считается нормальным?,1,TRUE,both,safety_logic_psychology,21%,21%,21%,TRUE,15%,15%,15%,FALSE,30%,30%,30%,FALSE,10%,10%,10%,FALSE
4,open,Опишите процедуру запуска газового оборудования,Газовое оборудованиени ишга тушириш тартибини тавсифланг,Опишите процедуру запуска газового оборудования,2,TRUE,natural_gas,other,,,,,,,,,,,,,,,,
5,single,Какое давление должно быть в газопроводе для бытового потребления?,Ҳунармандлик истеъмоли учун газопроводда қандай босим бўлиши керак?,Какое давление должно быть в газопроводе для бытового потребления?,2,TRUE,natural_gas,safety_logic_psychology,0.003 МПа,0.003 МПа,0.003 МПа,TRUE,0.3 МПа,0.3 МПа,0.3 МПа,FALSE,3 МПа,3 МПа,3 МПа,FALSE,30 МПа,30 МПа,30 МПа,FALSE
