title,description,is_active,time_limit_minutes,questions_count,passing_score,max_attempts,safety_logic_psychology_percentage,other_percentage,questions_count_junior,questions_count_engineer
"Тест по технике безопасности","Основы техники безопасности на производстве",true,60,30,70,3,70,30,25,35
"Тест по логике и IQ","Логические задачи и тесты на интеллект",true,45,25,75,2,80,20,20,30
"Психологический тест","Тест на психологическую готовность к работе",true,30,20,65,3,60,40,15,25
"Комплексный тест","Полный тест по всем направлениям",true,90,50,70,1,70,30,40,60
"Тест для новичков","Базовый тест для новых сотрудников",true,30,15,60,5,50,50,10,20
